{
  "method": "FatFormer",
  "track": "forensynths",
  "modality": "image",
  "model_type": "fat_former",
  "paper": "Liu et al., CVPR'24",
  "url": "https://github.com/SMSD75/SynthScope",
  "evaluation": "official-weights",
  "metrics": {
    "acc": 98.39,
    "map": 99.7,
    "ap": null,
    "auroc": null
  },
  "per_generator": null,
  "submitted_by": "SynthScope",
  "date": "2026-06-02",
  "verified": true,
  "source": "SynthScope reproduction (logged Test Metrics); see repro/FINAL_RESULTS.md",
  "protocol_notes": "ForenSynths-8 subset; official released weights",
  "synthscope_version": "0.1.0"
}
