{
  "method": "CO-SPY (official weights)",
  "track": "forensynths",
  "modality": "image",
  "model_type": "co_spy",
  "paper": "Cheng et al., CVPR'25",
  "url": "https://github.com/SMSD75/AGID",
  "evaluation": "official-weights",
  "metrics": {
    "acc": 95.12,
    "map": 98.71,
    "ap": null,
    "auroc": null
  },
  "per_generator": null,
  "submitted_by": "SynthScope",
  "date": "2026-06-02",
  "verified": true,
  "source": "SynthScope reproduction (logged Test Metrics); see repro/FINAL_RESULTS.md",
  "protocol_notes": "ForenSynths-8; vendored official architecture",
  "synthscope_version": "0.1.0"
}
